{"schema_version":"cognitive-runtime.state-correction-receipt/v2","receipt_id":"state-receipt-synthetic","preview_id":"preview-synthetic","preview_checksum":"sha256:1111111111111111111111111111111111111111111111111111111111111111","base_state_view_checksum":"sha256:0000000000000000000000000000000000000000000000000000000000000000","confirmed_by":"owner-synthetic","confirmation_method":"cli_plan_apply","confirmed_at":"2026-08-14T01:00:00Z","single_use":true}
